<?xml version="1.0"?>

<!DOCTYPE UWSimScene SYSTEM "UWSimScene.dtd" >

<UWSimScene>
<oceanState>
  <windx>0.04</windx>
  <windy>0.04</windy>
  <windSpeed>12</windSpeed>
  <depth>1000</depth>
  <reflectionDamping>0.35</reflectionDamping>
  <waveScale>1e-7</waveScale>
  <isNotChoppy>0</isNotChoppy>
  <choppyFactor>2.5</choppyFactor>
  <crestFoamHeight>2.2</crestFoamHeight>
  <oceanSurfaceHeight>0</oceanSurfaceHeight>
  <fog>
    <density>0.1</density>
    <color>
      <r>0.0</r>
      <g>0.05</g>
      <b>0.3</b>
    </color>
  </fog>
  <color>
    <r>0.0</r>
    <g>0.05</g>
    <b>0.3</b>
  </color>
  <attenuation>
    <r>0.015</r>
    <g>0.0075</g>
    <b>0.005</b>
  </attenuation>
</oceanState>
  
<simParams>
  <disableShaders>0</disableShaders>
  <resw>800</resw>
  <resh>600</resh>
  <offsetp>
    <x>0</x>
    <y>0</y>
    <z>0</z>
  </offsetp>
  <offsetr>
    <x>3.14</x>
    <y>0</y>
    <z>-1.57</z>
  </offsetr>
  <enablePhysics>1</enablePhysics>
  <showTrajectory>
    <target>block</target>
  </showTrajectory>
</simParams>

<camera>
  <freeMotion>1</freeMotion>
  <objectToTrack>block/base_link</objectToTrack>
  <fov>60</fov>
  <aspectRatio>1.33</aspectRatio>
  <near>0.1</near>
  <far>10000</far>
  <position>
    <x>-5</x>
    <y>-5</y>
    <z>8</z>
  </position>
  <lookAt>
    <x>0</x>
    <y>0</y>
    <z>0</z>
  </lookAt>
</camera>

<vehicle>
  <name>block</name> 
  <file>/opt/ros/melodic/share/urdf_tutorial/urdf/05-visual.urdf</file>
  
  <position>
    <x>2</x>
    <y>0</y>
    <z>2</z>
  </position>
  <orientation>
    <r>0</r>
    <p>0</p>
    <y>0</y>
  </orientation>

</vehicle>


<object>
  <name>terrain</name>
  <file>terrain/CIRS/cirs_trident.osg</file>
  <!-- <file>/opt/ros/melodic/share/uuv_gazebo_worlds/models/ocean/ocean.sdf</file> -->
  <position>
    <x>0</x>
    <y>0</y>
    <z>0</z>
  </position>
  <orientation>
    <r>0</r>
    <p>0</p>
    <y>0</y>
  </orientation>
  <offsetp>
    <x>-1.5</x>
    <y>-3.0</y>
    <z>0</z>
  </offsetp>
  <offsetr>
    <x>3.1415</x>
    <y>0</y>
    <z>-1.57</z>
  </offsetr>
  <physics>
    <mass>0</mass>
    <collisionShapeType>trimesh</collisionShapeType>
  </physics>
</object>

<object>
  <name>blackbox</name>
  <file>objects/blackbox_uib_trimesh.osg</file>
  <position>
    <x>0</x>
    <y>0</y>
    <z>4.7</z>
  </position>
  <orientation>
    <r>0</r>
    <p>3.1415</p>
    <y>0</y>
  </orientation>
  <physics>
    <mass>15</mass>
    <inertia>
      <x>0</x>
      <y>0</y>
      <z>0</z>
    </inertia>
    <collisionShapeType>box</collisionShapeType>
  </physics>
</object>

</UWSimScene>
